Component,Description,Source Data / Parameters,Calibration Method
Component Uncertainties,Per-sensor-family raw metrics of degradation.,"Sliding window statistics for drift and noise, lab comparisons for bias, and data gap rates (loss) derived from qpudatashards.",Using sensor calibration logs and residuals to define safe, gold, and hard bands for each component.
Normalized Component Risks,Normalized 0–1 scores for each uncertainty mode.,"r_drift, r_noise, r_bias, r_loss computed via piecewise affine corridor kernels.",Mapping raw component values into 0–1 using component-specific corridor bands stored in ecosafety.corridors.v2.
Composite Weight alpha_k,Relative importance of each uncertainty mode.,"alpha_drift, alpha_noise, alpha_bias, alpha_loss.",Regressing downstream incidents and K/E/R degradations on component risks to determine weights that best predict failures.
rsigma Corridor Bands,Thresholds for the composite uncertainty score.,"Safe band (for example 0.00–0.10), gold band (0.10–0.30), and hard band (>0.30) for rsigma entries in ecosafety.corridors.v2.",Aligning rsigma distributions with real-world failure modes and acceptable false-positive rates.
Final Output (rsigma),Normalized sensor uncertainty risk score.,"Computed from component risks and weights via the L2-norm rsigma formula, clamped to 0–1.",Verified via CI replay jobs that inject synthetic uncertainty (drift, noise, bias, loss) and check for expected increases in rsigma and Vt_full.
