Component,Description,Source Data / Parameters,Calibration Method
Diagnostic Counts,Row-level event counters for data-integrity issues.,qpudatashard diagnostics (e.g. Nmissing, Nschema, Ncorridor, Nunit).,Not applicable; these are direct measurements.
Ingest Error Weights,Scalar multipliers for diagnostic counts ordered by hazard.,Weights (m,s,c,u) corresponding to wmiss,wrfc,wtype,wvarid.,Regression on historical ingest logs to correlate with downstream K/E/R degradation.
Corridor Bands,Thresholds (Isafe, Igold, Ihard) for mapping scalar I to risk.,Band definitions (safemin/safemax, goldmin/goldmax, hardmin/hardmax) in ecosafety.corridors.v2.,Fit bands so empirical I distributions for labeled clean/moderate/chronic windows fall into target rcalib bands (0–0.1, 0.1–0.3, >0.3).
Normalization Kernel,Piecewise-affine function mapping I to rcalib in [0,1].,Defined by corridor bands, rgold, and kernel slopes.,Regression to choose slopes and rgold so typical clean operation sits near rcalib≈0–0.1, moderate problems in 0.1–0.3, and chronic failures near 1.
Final Output (rcalib),Normalized ingest-quality risk score.,Computed from scalar I using the normalization kernel.,Verified via CI replay jobs that test monotonicity under synthetic ingest faults.
